{
  "schemaVersion": "1.0.0",
  "name": "Embassy Commons",
  "countryCode": "NL",
  "country": "Netherlands",
  "city": "The Hague",
  "language": "en",
  "accent": "#f7931a",
  "mission": "An open starter kit for local communities to independently organise Bitcoin education, gatherings and collaboration.",
  "status": "draft"
}
